poem_id,poet_name,poem,translation,notes,meaning,poet_name_e,title
56.0,புல்லங்காடனார்,"நுரை தரும் ஓதம் கடந்து எமர் தந்த
கருங்கரை வன்மீன் கவரும் புள் ஓப்பின்
புகரில்லேம் யாமிருப்பப் பூங்கழிச் சேர்ப்பன்
நுகர்வனன் உண்டான் நலம்.
","Neythal What the heroine said to her friend
I was there without a fault,
chasing birds that came to
seize the strong, drying fish
that my brothers brought to
the vast shore, crossing the
waves that bring foam,
when the lord of the shores
with lovely backwaters enjoyed
me and took my virtue.
","  வரைவிடை பொருட்பிரிவில் தலைவன் நீட்டித்தவழித் தலைவி வருந்திக் கூறியது.
","நுரை தரும் ஓதம் – waves that bring foam, கடந்து – crossing, எமர் தந்த – my brothers and father, கருங்கரை – vast shore, வன்மீன் – strong fish, கவரும் புள் – seizing birds, ஓப்பின் – while chasing, புகர் இல்லேம் யாம் இருப்ப – I was there without a fault (இல்லேம் – தன்மைப் பன்மை), பூங்கழிச் சேர்ப்பன் – lord of the shores with lovely backwaters or backwaters with lovely flowers, நுகர்வனன் உண்டான் நலம் – enjoyed me and took my virtue
",Pullankaadanaar,"நெய்தல் தலைவி தோழியிடம் சொன்னது
"
57.0,புல்லங்காடனார்,"கொடுவாய்ப் புணர் அன்றில் கொய் மடல் பெண்ணைத்
தடவுக் கிளை பயிரும் தண் கடல் சேர்ப்பன்
நிலவுக் கொடுங்கழி நீந்திடும் முன்றில்
புலவுத் திரை பொருத போழ்து.
","Neythal What the heroine’s friend said to her
The lord of the cool ocean
shores,
will swim through the moon-lit,
curved backwaters and come
when the stinking waves attack
our front yard.
","  தலைவிக்கு இரவுக்குறியிடத்தை உணர்த்தியது.
","கொடுவாய் – curved beak, புணர் – unites, அன்றில் – ibis, கொய் மடல் – frond that could be cut, பெண்ணை – palmyra tree, தடவு – large, கிளை பயிரும் – calls its flock, தண் கடல் சேர்ப்பன் – lord of the cool ocean shores, நிலவு – bright, with moonlight, கொடுங்கழி – curved backwaters, நீந்திடும் – he will swim, முன்றில் – front yard, புலவுத் திரை – stinking waves, பொருத – attacking (the shores), போழ்து – time
",Pullankaadanaar,"நெய்தல் தோழி தலைவியிடம் சொன்னது
"
58.0,புல்லங்காடனார்,"சுறா எறி குப்பை சுழலும் கழியுள்
இறா எறி ஓதம் அலற இரைக்கும்
உறாஅ நீர்ச் சேர்ப்பனை உள்ளி இருப்பின்
பொறாஅ என் முன் கை வளை.
","Neythal What the heroine said to her friend
The bangles on my wrists
are unable to bear my sorrow,
if I think about the man who
does not unite with me now,
the lord of the ocean shores,
where schools of fish attacked
by sharks swirl in the backwaters,
and shrimp attacked by waves
scream.
","  தன் பிரிவு ஆற்றாமையை எடுத்துக் கூறி வருந்தினாள்.
","சுறா எறி – attacked by sharks, குப்பை – abundant quantity (of fish), சுழலும் – swirl, கழியுள் – in the backwaters, இறா – shrimp, எறி – attacked, ஓதம் – waves, அலற – scream, இரைக்கும் – make noises, உறாஅ –not uniting, நீர்ச் சேர்ப்பனை – lord of the shores, உள்ளி இருப்பின் – if I think about him, பொறாஅ – unable to tolerate (my sorrow), என் முன் கை வளை – the bangles on my wrist
",Pullankaadanaar,"நெய்தல் தலைவி தோழியிடம் சொன்னது
"
59.0,புல்லங்காடனார்,"தாழை குருகு ஈனும் தண்ணந் துறைவனை
மாழை மானோக்கின் மடமொழி நூழை
நுழையும் மடமகன் யார் கொல் என்று அன்னை
புழையும் அடைத்தாள் கதவு.
","Neythal What the heroine’s friend said to her  as the hero listened nearby
Oh one of delicate talk with
eyes like cut tiny mangoes,
and looks like that of a deer!
Mother closed the peep hole
on our door asking, “Who is
that idiot, the man who comes
through the small entry?”
about the lord of the cool shores
where thālai trees yield buds
resembling herons.
","  இரவுக்குறிக்கண் தலைவன் நிற்க, அதைத் தோழி தலைவியிடம் கூறுகின்றாள்.
","தாழை – thālai trees, pandanus odoratissimus, குருகு ஈனும் –  they bear buds that appear like herons, தண்ணந் துறைவனை – the lord of the cool shores, மாழை – young/tender mangoes (மாவடு), மானோக்கின் – looks of deer, மடமொழி – young woman of delicate talk, நூழை நுழையும் – enters through the small entry/path, மடமகன் யார் கொல் என்று – who is this idiot man, அன்னை – mother, புழையும் – also the small peep hole on the door, அடைத்தாள் – she closed it, கதவு – door
",Pullankaadanaar,"நெய்தல் தோழி தலைவியிடம் சொன்னது  சிறைப்புறத்தானாகிய தலைவன் கேட்கும்படி
"
60.0,புல்லங்காடனார்,"பொன்னம் பசலையும் தீர்ந்தது பூங்கொடி
தென்னவன் கொற்கைக் குருகு இரிய மன்னரை
ஓடு புறம் கண்ட ஒண் தாரான் தேர் இதோ
கூடல் அணைய வரவு.
","Neythal What the heroine’s friend said to her
Oh friend who is like a lovely vine!
Your golden pallor has ended now.
The chariot of the man wearing a
bright garland, who saw the backs
of fleeing enemies in battle,
causing herons to fly away from
Korkai city of the Pandiyan king,
is nearing Koodal city.
","  வினைமுற்று மீண்ட தலைவனின் வரவு கண்ட தோழி தலைவியிடம் கூறியது.
","பொன்னம் பசலையும் தீர்ந்தது – golden pallor has ended, பூங்கொடி – oh one like a flowering vine, oh one who is like a lovely vine (அன்மொழித்தொகை), தென்னவன் – the southern king, the Pandiyan king, கொற்கை – Korkai, குருகு இரிய – herons moved away (in fear), மன்னரை ஓடு புறம் கண்ட – one who saw the backs of enemies running away, ஒண் தாரான் – the man wearing a bright garland, தேர் – chariot, இதோ கூடல் அணைய வரவு – now he has come near Koodal city",Pullankaadanaar,"நெய்தல் தோழி தலைவியிடம் சொன்னது
"
