poem_id,poet_name,poem,translation,notes,meaning,poet_name_e,title,title_e
12.0,மதுரைக் கணக்காயனார் மகனார் நக்கீரர்,"ஆரம் தாழ்ந்த அம் பகட்டு மார்பின்
செம்பொறி வாங்கிய மொய்ம்பின் சுடர் விடுபு
வண் புகழ் நிறைந்து வசிந்து வாங்கு நிமிர் தோள்
விண் செலல் மரபின் ஐயர்க்கு ஏந்தியது
ஒரு கை உக்கம் சேர்த்தியது ஒரு கை
நலம் பெறு கலிங்கத்துக் குறங்கின் மிசை அசைஇயது ஒரு கை
அங்குசம் கடாவ ஒரு  கை இரு கை    
ஐ இரு வட்டமொடு எஃகு வலம் திரிப்ப ஒரு கை
மார்பொடு விளங்க ஒரு கை
தாரொடு பொலிய ஒரு கை
கீழ் வீழ் தொடியொடு மீமிசைக் கொட்ப ஒரு கை
பாடுஇன் படுமணி இரட்ட ஒருகை
நீல் நிற விசும்பின் மலி துளி பொழிய ஒரு கை
வானர மகளிர்க்கு வதுவை சூட்ட
ஆங்கு அப் பன்னிரு கையும் பாற்பட இயற்றி  – 
","His handsome, large chest adorned with gold
Garlands has three red lines that reach his curved,
straight, ray-emitting arms of great fame that split
the bodies of enemies.
One lifted arm is protecting great men who have the
tradition of going to the upper world.  One arm rests
on his waist.  One arm rests on his thigh with fine
clothes.  One arm carries an elephant goad.  One arm
holds a lovely, dark shield and the other one whirls
a spear.  One arm placed on his chest glows.  One arm
shines amidst his garlands.  One arm whirls with his
bracelets that move down.  One arm rings a sweet
sounding bell.  One arm causes heavy rains to fall
from the blue sky.  One arm places marriage
garlands on celestial women.  Thus the twelve arms
perform their duties corresponding to the faces.
","ஒரு கை வானர மகளிர்க்கு வதுவை சூட்ட (117):   நச்சினார்க்கினியர் உரை – வள்ளியோடு நகையமர்ந்த முகம் உலகிற்கு இல்வாழ்க்கை நிகழ்த்துவித்தலாகலின், அவ்வில்வாழ்க்கை நிகழ்த்துவதற்கு மழையை பெய்வித்தது ஒருகை; ஒருகை தெய்வ மகளிர்க்கு மணமாலையைச் சூட்ட, பொ. வே. சோமசுந்தரனார் உரை – இத் திருக்கையின் செயல் உலகின்கண் இல்லறம் நிகழ வேண்டி குறவர் மடமகளோடு நகையமர்ந்த திருமுகத்தின் செயலுக்குப் பொருந்துமாறு உணர்க.","ஆரம் தாழ்ந்த அம் பகட்டு மார்பின் – on the beautiful large chest with gold garlands/pearl strands/sandal garland hanging, செம்பொறி வாங்கிய – have the three lines/signs, மொய்ம்பின் – with great strength, சுடர் விடுபு – emits rays (விடுபு – விட்டு, செய்பு என்னும் வினையெச்சம்), வண் புகழ் நிறைந்து – with great fame, வசிந்து – split (bodies of enemies) வாங்கு நிமிர் தோள் – curved erect arms, curved erect shoulders, விண் செலல் மரபின் ஐயர்க்கு ஏந்தியது ஒரு கை – one lifted hand is protecting great men who go to the upper world, உக்கம் சேர்த்தியது ஒரு கை – one hand is placed on the waist,  நலம்பெறு கலிங்கத்துக் குறங்கின் மிசை அசைஇயது ஒரு கை – one hand is on the thigh with fine clothes (அசைஇயது – சொல்லிசை அளபெடை), அங்குசம் கடாவ ஒரு கை – one hand carries the elephant goad, இரு கை ஐ இரு வட்டமொடு எஃகு வலம் திரிப்ப – of the two hands – one holds a lovely dark shield and the other one whirls a spear, ஒரு கை மார்பொடு விளங்க  – one hand glows on his chest, ஒரு கை தாரொடு பொலிய – one hand shines with his garlands, one hand is beautiful with his garlands, ஒரு கை கீழ் வீழ் தொடியொடு மீமிசைக் கொட்ப – one hand has whirling low hanging bracelets on it (மீமிசை – ஒருபொருட் பன்மொழி), ஒரு கை பாடு இன் படு மணி இரட்ட – one hand rings a sweet sounding bell, ஒரு கை நீல் நிற விசும்பின் மலி துளி பொழிய – one hand causes heavy rains to fall from the blue heavens (நீல் – கடைக்குறை, poetical license which consists in the shortening of a word by elision of one or more letters in the end), ஒரு கை வானர மகளிர்க்கு வதுவை சூட்ட – one hand places marriage garlands on celestial women, ஆங்கு அப் பன்னிரு கையும் பாற்பட இயற்றி – thus the 12 hands did their work corresponding to the faces",Madurai Kanakkaayanaar son Nakkeerar,"பாடப்பட்டவன்:முருகப்பெருமான் திணை:பாடாண் துறை:ஆற்றுப்படை ஆசிரியப்பா பன்னிரு கைகளின் தொழில்கள்
","Paadaan Thinai aatrupadai Nature of his Twelve Arms
"
13.0,மதுரைக் கணக்காயனார் மகனார் நக்கீரர்,"அந்தரப் பல்லியம் கறங்க திண்காழ்
வயிர் எழுந்து இசைப்ப வால் வளை ஞரல    
உரந்தலைக் கொண்ட உரும்இடி முரசமொடு
பல்பொறி மஞ்ஞை வெல் கொடி அகவ
விசும்பு ஆறு ஆக விரை செலல் முன்னி
உலகம் புகழ்ந்த ஓங்கு உயர் விழுச்சீர்
அலைவாய்ச் சேறலும் நிலைஇய பண்பே அதாஅன்று  – 
","Celestial musical instruments are played.
Solid wood vayir horns blow, white conch shells
blare, drums roar like thunderbolts, and peacocks
with many spots screech from his victory banners.
Through the sky as his path, Murukan makes his
journey to Alaivāy of great fame.  That is his
established nature.  He is not just there.
",அந்தரப் பல்லியம் கறங்க (119) – பொ. வே. சோமசுந்தரனார் உரை – தேவத்தும்பி முழங்கவும்.,"அந்தரப் பல் இயம் கறங்க – celestial musical instruments are played, திண் காழ் வயிர் எழுந்து இசைப்ப – solid wood vayir horns are blown, வால் வளை ஞரல – white conch shells blare,  உரந்தலைக் கொண்ட உரும் இடி முரசமொடு – along with drums with the loud sounds of powerful thunder, பல் பொறி மஞ்ஞை வெல் கொடி அகவ – peacocks with many spots screech from victory banners, விசும்பு ஆறு ஆக – through the sky as a path, விரை செலல் முன்னி – considering to go fast, உலகம் புகழ்ந்த – praised by the world, ஓங்கு உயர் விழுச்சீர் – with lofty great fame (ஓங்கு உயர் – ஒருபொருட் பன்மொழி), அலைவாய்ச் சேறலும் – to reach Alaivāy, நிலைஇய பண்பே – that is his established nature (நிலைஇய – சொல்லிசை அளபெடை), அதாஅன்று – not just there (அது அன்று என்பன அதான்று எனப்புணர்ந்து வருமொழி முதல் அளபெடுத்து அதாஅன்று என்றாயிற்று.  அதாஅன்று அஃதன்றியும் என்னும் பொருட்டு, இசைநிறை அளபெடை)",Madurai Kanakkaayanaar son Nakkeerar,"பாடப்பட்டவன்:முருகப்பெருமான் திணை:பாடாண் துறை:ஆற்றுப்படை ஆசிரியப்பா அலைவாயில் ஆறுமுகன்
","Paadaan Thinai aatrupadai Murukan in Alaivāy
"
14.0,மதுரைக் கணக்காயனார் மகனார் நக்கீரர்,"சீரை தைஇய உடுக்கையர் சீரொடு
வலம்புரி புரையும் வால் நரை முடியினர்
மாசு அற இமைக்கும் உருவினர் மானின்
உரிவை தைஇய ஊன் கெடு மார்பின்
என்பு எழுந்து இயங்கும் யாக்கையர் நன்பகல்   
பல உடன் கழிந்த உண்டியர் இகலொடு
செற்றம் நீக்கிய மனத்தினர் யாவதும்
கற்றோர் அறியா அறிவினர் கற்றோர்க்குத்
தாம் வரம்பு ஆகிய தலைமையர் காமமொடு
கடுஞ்சினம் கடிந்த காட்சியர் இடும்பை
யாவதும் அறியா இயல்பினர் மேவரத்
துனி இல் காட்சி முனிவர் முற்புக  – 
","Intelligent sages who wear tree bark clothing
march in front, their hair beautiful and white
right-whorled conch shells, bodies shining in
purity covered with deer hide, flesh reduced
with ribs sticking out, they fast for many days.
Their minds not clouded with hatred,
they know even what the well-learned do not
know.  Their leadership is the limit for the learned.
They have removed great rage and desire from
their minds and they do not know pain.
",Not available,"சீரை தைஇய உடுக்கையர் – those wearing tree bark clothing (தைஇய – சொல்லிசை அளபெடை), சீரொடு – beautifully, வலம்புரி புரையும் – like the right-whorled conch shells (புரை – உவம உருபு, a comparison word), வால் நரை முடியினர் – those with white hair, மாசு அற இமைக்கும் உருவினர் – those whose bodies shine with purity, மானின் உரிவை தைஇய – clothed in deer hide (தைஇய – சொல்லிசை அளபெடை), ஊன் கெடு மார்பின் என்பு எழுந்து இயங்கும் யாக்கையர் – those with bodies with ruined flesh with ribs rising up on their chests, நன்பகல் பல உடன் கழிந்த உண்டியர் – those who do not eat for many days eating only now and then, இகலொடு செற்றம் நீக்கிய மனத்தினர் – those differing and with anger removed from them, those differing and with hatred removed from them, யாவதும் கற்றோர் அறியா அறிவினர் – intelligent people who know even what the well learned do not know, கற்றோர்க்குத் தாம் வரம்பு ஆகிய தலைமையர் – those whose leadership is the limit for the learned, காமமொடு கடுஞ்சினம் கடிந்த காட்சியர் – intelligent people who have removed great rage along with desire (காட்சியர் – அறிவுடையோர்), இடும்பை யாவதும் அறியா இயல்பினர் – those who do not know even a little bit of pain, மேவரத் துனி இல் காட்சி முனிவர் முற்புக  – sages with intelligence and nature without hatred leading in the front (காட்சி முனிவர் – அறிவிவினையுடைய முனிவர்கள்)",Madurai Kanakkaayanaar son Nakkeerar,"பாடப்பட்டவன்:முருகப்பெருமான் திணை:பாடாண் துறை:ஆற்றுப்படை ஆசிரியப்பா திருவாவினன்குடி (பழனி) முன் செல்லும் முனிவர்கள்
","Paadaan Thinai aatrupadai Thiruvāvinankudi (Palani) Sages
"
15.0,மதுரைக் கணக்காயனார் மகனார் நக்கீரர்,"புகை முகந்தன்ன மாசு இல் தூஉடை
முகை வாய் அவிழ்ந்த தகை சூழ் ஆகத்து
செவி நேர்பு வைத்த செய்வுறு திவவின்    
நல்யாழ் நவின்ற நயனுடை நெஞ்சின்
மென்மொழி மேவலர் இன் நரம்பு உளர 
","Celestials follow them, in their faultless
pure clothing that appear like they had
absorbed smoke, their noble chests donning garlands
with newly opened blossoms, their hearts kind, and
their words delicate because of the music of lutes they
play whose strings have been tuned listening to their
tones with sharp ears.
",Not available,"புகை முகந்தன்ன – like they had absorbed smoke, மாசு இல் தூஉடை – faultless pure clothing, முகை வாய் அவிழ்ந்த – buds opened their petal tips and blossomed, தகை சூழ் ஆகத்து – with beautiful chests with garlands, with esteemed chests with garlands, செவி நேர்பு வைத்த செய்வுறு திவவின் நல் யாழ் நவின்ற நயனுடை நெஞ்சின் – with kind hearts used to playing fine lutes with tied frets and listening to them with their sharp ears, மென்மொழி மேவலர் இன் நரம்பு உளர – celestials with delicate/kind words because of the music of the lute",Madurai Kanakkaayanaar son Nakkeerar,"பாடப்பட்டவன்:முருகப்பெருமான் திணை:பாடாண் துறை:ஆற்றுப்படை ஆசிரியப்பா மேவலர்
","Paadaan Thinai aatrupadai Celestials
"
16.0,மதுரைக் கணக்காயனார் மகனார் நக்கீரர்,"நோய் இன்று இயன்ற யாக்கையர் மாவின்
அவிர் தளிர் புரையும் மேனியர் அவிர்தொறும்
பொன் உரை கடுக்கும் திதலையர் இன்நகைப்
பருமம் தாங்கிய பணிந்து ஏந்து அல்குல்
மாசு இல் மகளிரொடு மறு இன்றி விளங்க  – 
","They are followed by their faultless women
wearing waist ornaments,
who shine with skins like bright mango tree
sprouts, bodies like touchstones on which
gold is rubbed, and loins that are lowered
and raised to perfection.
",பணிந்து ஏந்து அல்குல் (146) – பொ. வே. சோமசுந்தரனார் உரை – தாழ வேண்டியவிடம் தாழ்ந்து உயர வேண்டியவிடம் உயர்ந்த அல்குல்.,"நோய் இன்று இயன்ற யாக்கையர் – those with bodies without diseases, மாவின் அவிர் தளிர் புரையும் மேனியர் – those with bodies like the bright sprouts of mango trees, அவிர்தொறும் பொன் உரை கடுக்கும் – bright like touchstones that are rubbed with gold, திதலையர் – women with bodies with pallor, இன்நகைப் பருமம் தாங்கிய – bearing beautiful waist ornaments, பணிந்து – lowered, ஏந்து – raised, அல்குல் – loins, மாசு இல் மகளிரொடு மறு இன்றி விளங்க – shine with their women with no fault",Madurai Kanakkaayanaar son Nakkeerar,"பாடப்பட்டவன்:முருகப்பெருமான் திணை:பாடாண் துறை:ஆற்றுப்படை ஆசிரியப்பா பாடும் மகளிர்
","Paadaan Thinai aatrupadai Female Musicians
"
17.0,மதுரைக் கணக்காயனார் மகனார் நக்கீரர்,"கடுவொடு ஒடுங்கிய தூம்புடை வால் எயிற்று
அழல் என உயிர்க்கும் அஞ்சுவரு கடுந்திறல்
பாம்புபடப் புடைக்கும் பல்வரிக் கொடுஞ்சிறைப்   
புள் அணி நீள் கொடிச் செல்வனும் வெள் ஏறு
வலம்வயின் உயரிய பலர் புகழ் திணி தோள்
உமைஅமர்ந்து விளங்கும் இமையா முக்கண்
மூ எயில் முருக்கிய முரண்மிகு செல்வனும்
நூற்றுப் பத்து அடுக்கிய நாட்டத்து நூறு பல்
வேள்வி முற்றிய வென்று அடு கொற்றத்து
ஈர் இரண்டு ஏந்திய மருப்பின் எழில் நடை
தாழ் பெருந்தடக்கை உயர்த்த யானை
எருத்தம் ஏறிய திருக்கிளர் செல்வனும்  – 
","They are followed by Thirumal with his long
banner with the emblem of the bird garudan,
with many stripes on his curved wings, who
attacks and kills fierce snakes hissing like flame
that hide poison in their hollow, white fangs.
He is followed by powerful Sivan with three
unblinking eyes, destroyer of three fortresses,
who holds on his sturdy right arm praised by
many, a flag with white bull emblem.  He shines
with his consort Umai.
He is followed by prosperous Indiran who has
a thousand eyes, who has won victories over
enemies he vanquished by offering a hundred
sacrifices, who rides on the neck of his tall
elephant Airavatham with four raised tusks,
low hanging huge trunk and beautiful gait.
நாற்பெருந் தெய்வத்து நல்நகர் நிலைஇய . . .160
உலகம் காக்கும் ஒன்று புரி கொள்கைப்
பலர் புகழ் மூவரும் தலைவர் ஆக
ஏமுறு ஞாலம் தன்னில் தோன்றி
தாமரை பயந்த தா இல் ஊழி
நான்முக ஒருவற் சுட்டி காண்வர
பகலில் தோன்றும் இகல் இல் காட்சி
நால்வேறு இயற்கைப் பதினொரு மூவரொடு
ஒன்பதிற்று இரட்டி உயர்நிலை பெறீஇயர் (160 – 168)
Among the four Gods desiring the same
Principle of protecting the stable earth with
fine cities, only three praised by many have
appeared in this world. They pray to elevate
him to his high place, the faultless, four-faced
Brahman who rose from the navel lotus.
They are followed by thirty-three celestials of
four different categories, who do not differ in
their wisdom even though they appear to be
different since they are separated, and eighteen
deities presiding over the elements who attained
greatness.
",ஒன்பதிற்று இரட்டி (வரி 168) – பொ. வே. சோமசுந்தரனார் உரை – ஒன்பதிற்று இரட்டி என்றது பதினெண்கணங்களை.,"நாற்பெருந்தெய்வத்து – of the four great Gods (Brahman, Thirumal, Rudran, Indiran), நல் நகர் நிலைஇய உலகம் காக்கும் – protect the stable world with fine cities (நிலைஇய – சொல்லிசை அளபெடை), ஒன்று புரி – desiring the one matter (protection), கொள்கை – principle, பலர் புகழ் – praised by many, மூவரும் – the three Gods (Thirumal, Rudran, Indiran), தலைவர் ஆக – as leaders, ஏம் உறு ஞாலம் தன்னில் – in this world they protect (ஏம் உறு – ஏமம் என்பதன் கடைக்குறை), தோன்றி – appeared, தாமரை பயந்த – yielded by a lotus flower, தா இல் – faultless, perfect, ஊழி நான்முக ஒருவற் சுட்டி – to elevate the four-faced one/Brahman to his position, காண்வர – beautifully, பகலில் தோன்றும் – appearing to be parts (பகலில் – பகுத்து), இகல் இல் – not differing, காட்சி – intelligence, நால் வேறு இயற்கை – 4 different categories, பதினொரு மூவரொடு – with 33 celestials, ஒன்பதிற்று இரட்டி உயர்நிலை பெறீஇயர் – the 18 deities who preside over the elements who attained greatness (பெறீஇயர் – சொல்லிசை அளபெடை)",Madurai Kanakkaayanaar son Nakkeerar,"பாடப்பட்டவன்:முருகப்பெருமான் திணை:பாடாண் துறை:ஆற்றுப்படை ஆசிரியப்பா திருமால்  சிவன்  இந்திரன்
","Paadaan Thinai aatrupadai Four Gods and Celestials
"
