poem_id,poet_name,poem,translation,notes,meaning,poet_name_e,title,title_e
6.0,மதுரைக் கணக்காயனார் மகனார் நக்கீரர்,"உலறிய கதுப்பின் பிறழ்பல் பேழ்வாய்
சுழல் விழிப் பசுங்கண் சூர்த்த நோக்கின்
கழல்கண் கூகையொடு கடும் பாம்பு தூங்கப்
பெருமுலை அலைக்கும் காதின் பிணர் மோட்டு   
உருகெழு செலவின் அஞ்சுவரு பேய்மகள்
குருதி ஆடிய கூர் உகிர்க் கொடுவிரல்
கண் தொட்டு உண்ட கழிமுடைக் கருந்தலை
ஒண் தொடித் தடக் கையின் ஏந்தி வெருவர
வென்று அடு விறற் களம் பாடி தோள் பெயரா
நிணம் தின் வாயள் துணங்கை தூங்க  – 
","A fierce female ghoul with dry hair, crooked teeth,
big mouth, harsh looks with green colored eyes that
whirl, dangling earrings of dangerous snakes and owls
with whirling eyes that hit her breasts, coarse stomach,
fierce walk, played with blood, dug her curved fingers
with sharp nails into eyes and ate them, held the huge,
stinking, black head on her big hands with bright
bangles, sang causing fear in the murderous battlefield,
her mouth with fatty flesh, she performed thunangai
dance, moving her arms.
","கழி (53) – மிகுதிப் பொருள் குறித்து நின்ற உரிச்சொல்.  கூர்ப்பும் கழிவும் உள்ளது சிறக்கும் (தொல்காப்பியம், உரியியல் 16).  பெயரா – பெயர்த்து (நகர்த்தி) என்பது பொருள்.  செய்யா என்னும் வாய்பாட்டு வினையெச்சம்.  எதிர்மறைச் சொல்போல் காணப்படினும் உடன்பாட்டுப் பொருள் தருவது.  தட – தடவும் கயவும் நளியும் பெருமை (தொல்காப்பியம், உரியியல் 24).","உலறிய கதுப்பின் – with dried hair, பிறழ் பல் – disorderly teeth,  பேழ்வாய் – big mouth, gaping mouth, சுழல் விழிப் பசுங்கண் சூர்த்த நோக்கின் – fierce looks with green eyes that whirl, கழல் கண் கூகையொடு – with owl with whirling eyes, கடும் பாம்பு தூங்க – dangling dangerous snakes, பெரு முலை – large breasts, அலைக்கும் – moving, காதின் – on her ears, பிணர் மோட்டு – coarse stomach, உருகெழு செலவின் – fierce walk, அஞ்சுவரு பேய்மகள் – fierce female ghoul, குருதி ஆடிய – played in blood, கூர் உகிர்க் கொடு விரல் – sharp nails and curved fingers, கண் தொட்டு உண்ட – dug up and ate eyes, கழிமுடைக் கருந்தலை – greatly stinking black head, ஒண் தொடித் தடக் கையின் ஏந்தி – holding in big hands with bright bangles,  வெருவர causing fear, வென்று  அடு விறற் களம் பாடி – sang in the murderous victorious field, தோள் பெயரா – moving her arms/shoulders, நிணம் தின் வாயள் – she has a mouth that eats fatty flesh, துணங்கை தூங்க – she performs thunangai dance",Madurai Kanakkaayanaar son Nakkeerar,"பாடப்பட்டவன்:முருகப்பெருமான் திணை:பாடாண் துறை:ஆற்றுப்படை ஆசிரியப்பா பேய்மகளின் துணங்கை
","Paadaan Thinai aatrupadai Thunangai performed by a Female Ghoul
"
7.0,மதுரைக் கணக்காயனார் மகனார் நக்கீரர்,"இரு பேர் உருவின் ஒரு பேர் யாக்கை
அறு வேறு வகையின் அஞ்சுவர மண்டி
அவுணர் நல்வலம் அடங்க கவிழ் இணர்
மா முதல் தடிந்த மறு இல் கொற்றத்து    
எய்யா நல் இசை செவ்வேற் சேஎய்  – 
","Murukan, bearing a fine spear, with great fame that
is immeasurable, chopped the trunk of a mango tree
heavy with bent fruit clusters, to control the Asurars.
He cut the body of Sooran with man and beast form
and challenged him to fight with all his six forms
combined as one.
",Not available,"இரு பேர் உருவின் ஒரு பேர் யாக்கை – one body with two different forms – man and beast, அறு வேறு வகையின் – with six different forms, அஞ்சுவர மண்டி – went rapidly causing fear, அவுணர் நல்வலம் அடங்க – to control the victory of Asurars, கவிழ் இணர் – bent clusters, மா முதல் தடிந்த – chopped the trunk of a mango tree, மறு இல் கொற்றத்து – with faultless victory, எய்யா நல் இசை – great fame that is immeasurable, செவ்வேற் சேஎய் – Murukan with fine spear",Madurai Kanakkaayanaar son Nakkeerar,"பாடப்பட்டவன்:முருகப்பெருமான் திணை:பாடாண் துறை:ஆற்றுப்படை ஆசிரியப்பா முருகன் மாமரத்தை வெட்டுதல்
","Paadaan Thinai aatrupadai Chopped a Mango Tree
"
8.0,மதுரைக் கணக்காயனார் மகனார் நக்கீரர்,"சேவடி படரும் செம்மல் உள்ளமொடு
நலம்புரி கொள்கைப் புலம் பிரிந்து உறையும்
செலவு நீ நயந்தனை ஆயின் பல உடன்
நன்னர் நெஞ்சத்து இன்நசை வாய்ப்ப
இன்னே பெறுதி நீ முன்னிய வினையே  – 
","If you go with a mind of surrendering to his fine feet
with the principle of doing good, moving away from
bodily desires and desiring eternal bliss with a good
heart through many births, good fame will occur, and
you will get the benefits of your past actions.
",Not available,"சேவடி படரும் செம்மல் உள்ளமொடு – with a great mind of going toward his fine/red feet, நலம்புரி கொள்கை – principle of doing good, புலம் பிரிந்து உறையும் – moving away from bodily desires, செலவு நீ நயந்தனை ஆயின் – if you desire to go, பல உடன் – many births, நன்னர் நெஞ்சத்து – with a good heart, இன் நசை வாய்ப்ப – good fame to occur, இன்னே பெறுதி நீ முன்னிய வினையே – now you will get the benefit of your past considerations (பெறுதி – முன்னிலை வினைமுற்று)",Madurai Kanakkaayanaar son Nakkeerar,"பாடப்பட்டவன்:முருகப்பெருமான் திணை:பாடாண் துறை:ஆற்றுப்படை ஆசிரியப்பா ஆற்றுப்படுத்தல்
","Paadaan Thinai aatrupadai Offering Guidance
"
9.0,மதுரைக் கணக்காயனார் மகனார் நக்கீரர்,"செருப் புகன்று எடுத்த சேண் உயர் நெடுங்கொடி
வரிப் புனை பந்தொடு பாவை தூங்க
பொருநர்த் தேய்த்த போர் அரு வாயில்
திரு வீற்றிருந்த தீது தீர் நியமத்து    
மாடம் மலி மறுகின் கூடற் குடவயின்
இருஞ்சேற்று அகல்வயல் விரிந்து வாய் அவிழ்ந்த
முள் தாள் தாமரைத் துஞ்சி வைகறைக்
கள் கமழ் நெய்தல் ஊதி எல் படக்
கண் போல் மலர்ந்த காமரு சுனைமலர்
அஞ்சிறை வண்டின் அரிக் கணம் ஒலிக்கும்
குன்று அமர்ந்து உறைதலும் உரியன் அதாஅன்று  – 
","He resides in Thirupparankundram, where tall
victory flags raised with desire fly high at the
entrance, along with striped balls and hanging
dolls.  Enemies were ruined at the gate where
battles are rare.  The mountain is on the west of
Koodal city with streets filled with mansions and
faultless markets where wealth resides.  There are
wide fields with dark mud where lotus flowers with
thorny stems flourish.  Bees sleep on them at night
and buzz on neythal flowers with honey in the
morning.  At sunset, the sounds of beautiful swarms
of bees with beautiful wings hovering over pretty
pond flowers, are heard.
He is not just there.
","வரிப் பந்து – நற்றிணை 12 – வரி புனை பந்தொடு – பின்னத்தூர் அ. நாராயணசாமி ஐயர் உரை, ஒளவை துரைசாமி உரை – வரிந்து புனையப்பட்ட பந்தொடு, திருமுருகாற்றுப்படை 68 – வரிப் புனை பந்தொடு – பொ. வே. சோமசுந்தரனார் உரை – நூலால் வரிந்து புனையப்பட்ட பந்தும், நச்சினார்க்கினியர் உரை – நூலால் வரிந்து புனையப்பட்ட பந்தும், வை. மு. கோபாலகிருஷ்ணமாசாரி  உரை – நூலால் வரிந்து புனையப்பட்ட பந்தோடு, கலித்தொகை 51 – வரிப் பந்து – நச்சினார்க்கினியர் உரை – வரியினையுடைய பந்து, பரிபாடல் 9 – வரிப் பந்து – பொ. வே. சோமசுந்தரனார் உரை – வரியினையுடைய பந்து, பெரும்பாணாற்றுப்படை 333 – வரிப்பந்து – பொ. வே. சோமசுந்தரனார் உரை – நூலால் வரியப்பட்ட பந்து.","செருப்  புகன்று எடுத்த – entered battles with desire and raised, சேண் உயர் – far and high, நெடுங்கொடி – tall flags, வரிப் புனை பந்தொடு – along with ball with designs/stripes,  பாவை தூங்க – doll hanging/resting, பொருநர்த் தேய்த்த – ruined enemies, போர் அரு வாயில் – rare/protected gate, திரு வீற்றிருந்த – where wealth/Lakshmi resides, தீது தீர் நியமத்து – with markets without fault, மாடம் மலி மறுகின் – with streets filled with mansions, கூடற் குடவயின் – on the west side of Koodal/Mathurai, இருஞ்சேற்று அகல்வயல் – wide fields with dark mud,  விரிந்து வாய் அவிழ்ந்த – open fully and blossomed, முள் தாள் தாமரைத் துஞ்சி – sleeping in the lotus flowers with thorny stems, வைகறைக் கள் கமழ் நெய்தல் ஊதி – swarming on honey-fragrant waterlilies in the early mornings, எல் படக் கண் போல் மலர்ந்த – blossomed like eyes when the sun arrived, காமரு சுனை மலர் – beautiful pond flowers (காமரு – விகாரம்), அஞ்சிறை வண்டின் அரிக்கணம் ஒலிக்கும் – the humming sounds of beautiful swarms of bees with beautiful wings are heard, குன்று அமர்ந்து உறைதலும் உரியன் – the god who resides in the mountains, அதாஅன்று – not just there (அது அன்று என்பன அதான்று எனப்புணர்ந்து வருமொழி முதல் அளபெடுத்து அதாஅன்று என்றாயிற்று.  அதாஅன்று அஃதன்றியும் என்னும் பொருட்டு, இசைநிறை அளபெடை)",Madurai Kanakkaayanaar son Nakkeerar,"பாடப்பட்டவன்:முருகப்பெருமான் திணை:பாடாண் துறை:ஆற்றுப்படை ஆசிரியப்பா திருப்பரங்குன்றில் முருகன் வீற்றிருத்தல்
","Paadaan Thinai aatrupadai Murukan is seated in Thirupparankundram
"
10.0,மதுரைக் கணக்காயனார் மகனார் நக்கீரர்,"வைந்நுதி பொருத வடுஆழ் வரிநுதல்
வாடா மாலை ஓடையொடு துயல்வர
படுமணி இரட்டும் மருங்கின் கடு நடை    
கூற்றத்து அன்ன மாற்று அரு மொய்ம்பின்
கால் கிளர்ந்தன்ன வேழம் மேல் கொண்டு  – 
","He rides on an elephant with swift gait
as fast as the wind, with great strength that
cannot be stopped, like Kootruvan of rapid walk,
with jingling bells hanging on both sides, gold
ōdai ornaments, and face lines with deep scars
caused by weapons with sharp tips.
",Not available,"வைந்நுதி – sharp tips, பொருத – attacked, வடு ஆழ் வரி நுதல் – face with lines and deep scars, வாடா மாலை ஓடையொடு – with ōdai ornaments that do not fade, with gold ōdai ornaments (வாடா மாலை – பொன் மாலைக்கு வெளிப்படை), துயல்வர படுமணி இரட்டும் மருங்கின் – on the sides where the hanging bells sway and jingle, கடு நடை – rapid walk, கூற்றத்து அன்ன – like Kootruvan who is the god of death (கூற்றத்து – கூற்றம், அத்து சாரியை), மாற்று அரு மொய்ம்பின் – with great strength that cannot be stopped, கால் கிளர்ந்தன்ன வேழம் மேல் கொண்டு – climbing on an elephant as rapid as the rising wind",Madurai Kanakkaayanaar son Nakkeerar,"பாடப்பட்டவன்:முருகப்பெருமான் திணை:பாடாண் துறை:ஆற்றுப்படை ஆசிரியப்பா திருச்சீரலைவாய் (திருச்செந்தூர்) ஆறுமுகன் யானையின் மேல் ஏறி வருதல்
","Paadaan Thinai aatrupadai Thirucheeralaivāy (Thiruchendur) Murukan riding an elephant
"
11.0,மதுரைக் கணக்காயனார் மகனார் நக்கீரர்,"ஐவேறு உருவின் செய்வினை முற்றிய
முடியொடு விளங்கிய முரண்மிகு திருமணி
மின் உறழ் இமைப்பின் சென்னிப் பொற்ப
நகை தாழ்பு துயல்வரூஉம் வகை அமை பொலங்குழை
சேண் விளங்கு இயற்கை வாள் மதி கவைஇ
அகலா மீனின் அவிர்வன இமைப்ப
தா இல் கொள்கைத் தம் தொழில் முடிமார்
மனன் நேர்பு எழுதரு வாள் நிற முகனே    
மா இருள் ஞாலம் மறு இன்றி விளங்க
பல் கதிர் விரிந்தன்று ஒரு முகம் ஒரு முகம்
ஆர்வலர் ஏத்த அமர்ந்து இனிது ஒழுகி
காதலின் உவந்து வரம் கொடுத்தன்றே ஒரு முகம்
மந்திர விதியின் மரபுளி வழாஅ
அந்தணர் வேள்வி ஓர்க்கும்மே ஒரு முகம்
எஞ்சிய பொருள்களை ஏமுற நாடி
திங்கள் போலத்திசை விளக்கும்மே ஒரு முகம்
செறுநர்த் தேய்த்துச் செல் சமம் முருக்கி
கறுவு கொள் நெஞ்சமொடு களம் வேட்டன்றே ஒரு முகம்  
குறவர் மடமகள் கொடிபோல் நுசுப்பின்
மடவரல் வள்ளியொடு நகை அமர்ந்தன்றே
ஆங்கு அம்மூ இரு முகனும் முறை நவின்று ஒழுகலின்  – 
","The lovely crown on his splendid head bears five
different shapes and it is bright with many kinds
of gems that glitter like lightning flashes.  The gold
earrings on his ears display excellent craftsmanship
and they sway, dazzling like the permanent stars that
surround the bright moon that gleams even at a
distance.
The radiant faces of Murukan shine brilliantly in
the hearts of those with faultless principles.  One
face spreads many beams of light to make the huge,
dark earth glow and flourish without faults.  One
face showers boons with love on devotees who praise
him.  One face listens to Brahmins who follow ancient
tradition and chant Vedas.  One face brightens
directions like the moon, examining the contents of
the scriptures that are difficult to comprehend,
with protection.  One face destroys enemies in battles
with rage and performs rituals in the battlefield.
One face is blissful in the company of the daughter
of a mountain dweller, Valli with vine-like waist.
Thus the six faces perform their duties.
","களவேள்வி – புறநானூறு 26 – மன்னிய வேள்வி முற்றிய வாய்வாள் வேந்தே, புறநானூறு 372 – புலவுக் களம் பொலிய வேட்டோய், மதுரைக்காஞ்சி 128-130 – களம்வேட்ட அடு திறல் உயர் புகழ் வேந்தே, திருமுருகாற்றுப்படை 100 – களம் வேட்டன்றே ஒரு முகம்.  பொற்பு – பொற்பே பொலிவு (தொல்காப்பியம், உரியியல் 39).  ஐவேறு உருவின் (83) – பொ. வே. சோமசுந்தரனார் உரை – தாமம், முகடம், பதுமம், கிம்புரி, கோடகம் என்னும் ஐந்து வகையாகச் செய்யப்படும் தொழிற்திறம் முற்றிய தலையணிகலன் என்றவாறு.","ஐவேறு உருவின் – in five different shapes for the 5 additional faces (Murukan has a head with 5 different faces), செய்வினை முற்றிய முடியொடு – with a crown with perfection in work, விளங்கிய முரண் மிகு திருமணி –  bright differing beautiful gems, மின் உறழ் இமைப்பின் – glittering like lightning (உறழ் – உவம உருபு), சென்னிப் பொற்ப – head is splendid, நகை தாழ்பு  துயல்வரூஉம் வகை – bright hanging variety of jewels (வரூஉம் – இன்னிசை அளபெடை), அமை பொலங்குழை – perfect golden earrings, சேண் விளங்கு இயற்கை வாள் மதி கவைஇ – surrounding the bright moon which shines even at a distance (கவைஇ – சொல்லிசை அளபெடை), அகலா மீனின் அவிர்வன இமைப்ப – they glitter like stars which do not go away (மீனின் – இன் ஐந்தாம் வேற்றுமை உருபு, ஒப்புப் பொருளில் வந்தது), தா இல் கொள்கைத் தம் தொழில் முடிமார் – those who finish their business with faultless principles, மனன் நேர்பு எழுதரு – that appears in their hearts (மனன் – மனம் என்பதன் போலி), வாள் நிற முகனே – one with a bright face (முகன் – முகம் என்பதன் போலி), மா இருள் ஞாலம் – the huge dark world, மறு இன்றி விளங்க – to flourish without fault, பல் கதிர் விரிந்தன்று ஒரு முகம் – one face spreads many beams of light, ஒரு முகம் ஆர்வலர் ஏத்த அமர்ந்து இனிது ஒழுகி காதலின் உவந்து வரம் கொடுத்தன்றே – one face as devotees praise gives them happily boons with love, ஒரு முகம் மந்திர விதியின் மரபுளி வழாஅ அந்தணர் வேள்வி ஓர்க்கும்மே – one face listens to the Vedas chanted by Brahmins who follow tradition and chant in a faultless manner (வழாஅ – இசை நிறை அளபெடை, ஓர்க்கும்மே – ஒர்க்கும் + ஏ, ஏகாரம் அசை), ஒரு முகம் எஞ்சிய பொருள்களை ஏம் உற நாடி திங்கள் போலத் திசை விளக்கும்மே – one face brightens directions like the moon examining the contents of the scriptures that are difficult to comprehend with protection (ஏம் – காவல், ஏமம் என்பதன் கடைக்குறை), ஒரு முகம் செறுநர்த் தேய்த்துச் செல் சமம் முருக்கி கறுவு கொள் நெஞ்சமொடு களம் வேட்டன்றே – one face ruins enemies in victorious battles with rage and performs rituals in the battlefield, ஒரு முகம் குறவர் மடமகள் கொடி போல் நுசுப்பின் மடவரல் வள்ளியொடு நகை அமர்ந்தன்றே – one face is blissful in the company of Valli with a vine-like waist who is the daughter of a mountain dweller, ஆங்கு அம்மூ இரு முகனும் – there the six faces, முறை நவின்று ஒழுகலின் – since they perform their duties (முகன் – முகம் என்பதன் போலி)",Madurai Kanakkaayanaar son Nakkeerar,"பாடப்பட்டவன்:முருகப்பெருமான் திணை:பாடாண் துறை:ஆற்றுப்படை ஆசிரியப்பா ஆறுமுகங்களின் இயல்புகள்
","Paadaan Thinai aatrupadai Nature of the Six Faces
"
