poem_id,poet_name,poem,translation,notes,meaning,poet_name_e,title,title_e
26.0,மதுரைக் கணக்காயனார் மகனார் நக்கீரர்,"ஆண்தலைக் கொடியொடு மண்ணி அமைவர
நெய்யோடு ஐயவி அப்பி ஐது உரைத்து
குடந்தம்பட்டு கொழுமலர் சிதறி
முரண்கொள் உருவின் இரண்டு உடன் உடீஇ   
செந்நூல் யாத்து வெண்பொரி சிதறி
மதவலி நிலைஇய மாத்தாட் கொழு விடைக்
குருதியொடு விரைஇய தூவெள் அரிசி
சில்பலிச் செய்து பல்பிரப்பு இரீஇ
சிறுபசு மஞ்சளொடு நறு விரை தெளித்து
பெருந்தண் கணவீர நறுந்தண் மாலை
துணையுற அறுத்துத் தூங்க நாற்றி
நளிமலைச் சிலம்பில் நல்நகர் வாழ்த்தி
நறும்புகை எடுத்து குறிஞ்சி பாடி
இமிழ் இசை அருவியொடு இன் இயம் கறங்க   
உருவப் பல்பூத் தூஉய் வெருவரக்
குருதிச் செந்தினை பரப்பி குறமகள்
முருகு இயம் நிறுத்து முரணினர் உட்க
முருகு ஆற்றுப்படுத்த உருகெழு வியல் நகர்  – 
","To invite Murukan, a woman from the dense
mountain planted a flag with a man’s head and
a bird’s body, applied ghee and tiny mustard seed
paste, chanted softly, worshipped strewing big
flowers, wore clothing of two different shapes, tied
red thread, scattered puffed rice, mixed the blood
of a fat male goat with great strength and huge legs,
gave many offerings, offered fragrant water and
small, fresh turmeric, hung cool, red oleander
garlands together,
spread fragrant smoke, sang kurinji tune songs,
played musical instruments that sounded along
with roaring waterfalls, threw as offerings many
flowers with various shapes, spread fear-causing
blood with red millet, and played instruments to
please him, that caused fear in non-believers in
the fierce, huge temple of Murukan.
","ஆண்தலை (227) – மாண்தலை என்றும் பாடம் உண்டு.    நச்சினார்க்கினியர் உரை – ஆண்தலைக் கொடி என்பது பாடமாயின் தலை ஆண்மகனின் தலையாகவும் உடல் புள்ளின் உடலாகவும் எழுதின கொடி என்க.  உரு (244) – அச்சம்.  உரு உட்காகும் புரை உயர்வாகும். (தொல்காப்பியம், உரியியல் 4).  நளி – தடவும் கயவும் நளியும் பெருமை (தொல்காப்பியம், உரியியல் 24), நளி என் கிளவி செறிவும் ஆகும், (தொல்காப்பியம், உரியியல் 24).  குடந்தம்பட்டு (229) – நச்சினார்க்கினியர் உரை – வணங்குதல், வழிபடுதல்.  குடவென்பது தடவென்பது போல வளைவை உணர்த்துவதோர் உரிச்சொல்லாகலின் அதனடியாகப் பிறந்த பெயருமாம்.","ஆண்தலைக் கொடியொடு – with flag with a head of man and body of a bird, மண்ணி அமைவர – to clean, நெய்யோடு ஐயவி அப்பி –  rubbed ghee and white mustard paste, ஐது உரைத்து – chanted delicately, chanted beautifully, குடந்தம்பட்டு – worshipped, கொழு மலர் சிதறி – strew big flowers, முரண் கொள் உருவின் இரண்டு உடன் உடீஇ – wore with two different shaped clothing (உடீஇ – சொல்லிசை அளபெடை), செந்நூல் யாத்து – tied red thread, வெண்பொரி சிதறி – scattered white puffed rice, மதவலி நிலைஇய மாத்தாட் கொழு விடைக் குருதியொடு விரைஇய – mix with blood of fat male goat with great strength and huge legs (மதவலி – ஒருபொருட் பன்மொழி, நிலைஇய – சொல்லிசை அளபெடை, விரைஇய – சொல்லிசை அளபெடை), தூ வெள் அரிசி சில் பலிச் செய்து – offered a little pure white rice, பல் பிரப்பு இரீஇ – gave many offerings (இரீஇ – சொல்லிசை அளபெடை), சிறு பசு மஞ்சளொடு – along with small fresh turmeric, நறு விரை தெளித்து – scattered fragrant water, பெருந்தண் கணவீர – huge cool red oleander, நறுந்தண் மாலை – fragrant cool garlands, துணையுற – together, அறுத்துத் தூங்க நாற்றி – cut and hung, நளி மலைச் சிலம்பில் – on the dense mountain, on the huge mountain, நல் நகர் வாழ்த்தி – praise the fine houses,  நறும் புகை எடுத்து – spread fragrant smoke, குறிஞ்சி பாடி – sang in kurinji melody, இமிழ் இசை அருவியொடு இன் இயம் கறங்க – played sweet music along with sweet music roaring waterfalls, உருவப் பல் பூத் தூஉய் – throw as offerings many flowers with different shapes (தூஉய் – இன்னிசை அளபெடை), வெருவரக் குருதிச் செந்தினை பரப்பி – spread blood with red/fine millet causing fear, குறமகள் முருகு இயம் நிறுத்து – the mountain woman playing instruments that please Murukan, முரணினர் உட்க – causing fear to those not agreeable, முருகு ஆற்றுப்படுத்த – causing Murukan to come, உருகெழு வியல் நகர் – fierce huge temple",Madurai Kanakkaayanaar son Nakkeerar,"பாடப்பட்டவன்:முருகப்பெருமான் திணை:பாடாண் துறை:ஆற்றுப்படை ஆசிரியப்பா குறமகளின் வெறியாட்டு
","Paadaan Thinai aatrupadai Veriyāttam Ritual
"
27.0,மதுரைக் கணக்காயனார் மகனார் நக்கீரர்,"ஆடுகளம் சிலம்பப் பாடி பலவுடன்
கோடு வாய் வைத்து கொடுமணி இயக்கி
ஓடாப் பூட்கைப் பிணிமுகம் வாழ்த்தி
வேண்டுநர் வேண்டியாங்கு எய்தினர் வழிபட
ஆண்டு ஆண்டு உறைதலும் அறிந்தவாறே  
","Singing loudly in the veriyāttam ground with
frenzied dances, as horns were blown and
curved bells were rung, the devotees praised the
brave elephant Pinimukam that does not back off.
Murukan lives there forever for those who worship
as they desire, like they have attained, as I am aware.
","பலவுடன் கோடு வாய் வைத்து (245-246) – கோடு பலவுடன் வாய் வைத்து என்று படிக்கவும்.  பிணிமுகம் (247) – பொ. வே. சோமசுந்தரனார் உரை – பிணிமுகம் என்ற பட்டதையுடைய யானை.  பிணிமுகம் என்பதற்குப் பெரும்பாலோர் மயில் என்றே பொருள் கூறுவர்.  பிணிமுகம் என்பது முருகன் ஏறும் யானை ஒன்றற்கே பெயர் என்பாரும் உளர்.  பிணிமுகம் வாழ்த்தும் வழக்கத்தை ‘கடம்பும் களிறும் பாடி’ (தொல்காப்பியம், பொருளதிகாரம் 16) என்பதானும் அறிக.  பிணிமுகம் என்பதனைப் பட்டம் எனக் கொண்டு அதனுடைய யானை என்றார் நச்சினார்க்கினியர்.  இப்பொருளில் பிணிமுகம் என்பது அன்மொழித்தொகை என்க.","ஆடு களம் சிலம்பப் பாடி – singing loudly in the veriyāttam ground, பலவுடன் கோடு வாய்வைத்து – many horns were blown, கொடு மணி இயக்கி – they rang curved bells, ஓடாப் பூட்கைப் பிணிமுகம் வாழ்த்தி – they praised the brave elephant named Pinimukam that does not back off, வேண்டுநர் – those who desire, வேண்டியாங்கு எய்தினர் வழிபட – for those to worship as they desire like they attained, ஆண்டு ஆண்டு உறைதலும் – lives there forever, அறிந்தவாறே – as I know",Madurai Kanakkaayanaar son Nakkeerar,"பாடப்பட்டவன்:முருகப்பெருமான் திணை:பாடாண் துறை:ஆற்றுப்படை ஆசிரியப்பா குறமகளின் வெறியாட்டு
","Paadaan Thinai aatrupadai Veriyāttam Ritual
"
28.0,மதுரைக் கணக்காயனார் மகனார் நக்கீரர்,"ஆண்டுஆண்டு ஆயினும் ஆக காண்தக    
முந்து நீ கண்டுழி முகன் அமர்ந்து ஏத்தி
கை தொழூஉப் பரவி கால் உற வணங்கி
நெடும் பெருஞ் சிமையத்து நீலப் பைஞ்சுனை
ஐவருள் ஒருவன் அங்கை ஏற்ப
அறுவர் பயந்த ஆறு அமர் செல்வ
ஆல் கெழு கடவுட் புதல்வ மால்வரை
மலைமகள் மகனே மாற்றோர் கூற்றே
வெற்றி வெல்போர்க் கொற்றவை சிறுவ
இழை அணி சிறப்பின் பழையோள் குழவி
வானோர் வணங்கு வில் தானைத் தலைவ   
மாலை மார்ப நூல் அறி புலவ
செருவில் ஒருவ பொருவிறல் மள்ள
அந்தணர் வெறுக்கை அறிந்தோர் சொல்மலை
மங்கையர் கணவ மைந்தர் ஏறே
வேல் கெழு தடக்கைச் சால் பெருஞ் செல்வ
குன்றம் கொன்ற குன்றாக் கொற்றத்து
விண் பொரு நெடு வரைக் குறிஞ்சிக் கிழவ
பலர் புகழ் நன்மொழிப் புலவர் ஏறே
அரும் பெறல் மரபின் பெரும் பெயர் முருக
நசையுநர்க்கு ஆர்த்தும் இசை பேர் ஆள    
அலந்தோர்க்கு அளிக்கும் பொலம் பூண் சேஎய்
மண்டு அமர் கடந்த நின் வென்று ஆடு அகலத்து
பரிசிலர்த் தாங்கும் உருகெழு நெடுவேஎள்
பெரியோர் ஏத்தும் பெரும்பெயர் இயவுள்
சூர்மருங்கு அறுத்த மொய்ம்பின் மதவலி
போர் மிகு பொருந குரிசில் எனப்பல
யான்அறி அளவையின் ஏத்தி ஆனாது  – 
","When you see him in front of you, the one who
exists for eons, praise him, lift your hands and
pray to him.  Worship prostrating so that your
head can touch his feet.
Tell him, “O Lord who was received by fire,
one of the five elements, on its palms, born to six
in six forms in a fresh mountain spring rich in
kuvalai blossoms, O son of Sivan under a banyan tree,
O son of Parvathi, the daughter of a mountain king,
O lord who is death to enemies, O son of Kotravai
who is victorious in battles, O child of the ancient forest
goddess with splendid jewels, O lord of an army with
curved bows worshipped by celestials, O Lord donning
flower garlands on your chest, O lord with knowledge of
books, O brave warrior of battles, O wealth of Brahmins,
O words of the wise, O husband of women, O lion among
warriors,
O Great, noble Lord with a large hand that carries a spear,
O Lord who broke a mountain, O Lord of the mountains
that touch the skies, O Lord who is like a lion to poets
with fine words and great fame, O Murukan with great
name and precious tradition, O famed Lord who gives
boons to those who seek you, O Red Lord with gold jewels
who gives to those who are suffering, O fierce Lord whose
victorious chest helps those who come to you in need,
O Great God who is praised by the wise! O Lord with great
strength who fought battles and killed Sooran and his clan.”
Praise him in this manner.  This is what I know.
","Perumpānātruppadai lines 456-458 refer to Kotravai being the mother of Murukan கடுஞ்சூர் கொன்ற பைம்பூண் சேஎய் பயந்த மாமோட்டு துணங்கை அம் செல்வி.  She is also mentioned in Akanānūru 245-4 as கான் அமர் செல்வி.  பழையோள் (259) – நச்சினார்க்கினியர் உரை – காடு கிழாள்.  தட – தடவும் கயவும் நளியும் பெருமை (தொல்காப்பியம், உரியியல் 24).","ஆண்டு ஆண்டு ஆயினும் ஆக – one who is there for eons and eons, காண்தக – worthy to see, முந்து நீ கண்டுழி – when you see him in front of you, முகன் அமர்ந்து ஏத்தி – look at him with your face and praise him, கைதொழூஉப் பரவி – lift your hands and worship him, கால் உற வணங்கி – fall down and worship him for your head to touch his feet, நெடும் பெருஞ் சிமையத்து நீலப் பைஞ்சுனை – in a fresh spring with blue waterlilies on a huge mountain summit, in a fresh spring with tharuppai grass, ஐவருள் ஒருவன் – one among five – sky, wind, fire, water, land, அங்கை ஏற்ப – holding in its palms, அறுவர் பயந்த ஆறு அமர் செல்வ – O lord with six forms who came into being because of six, ஆல் கெழு கடவுட் புதல்வ – O son of Sivan under a banyan tree, மால்வரை மலைமகள் மகனே – O son of Parvathi (Umai) who is the daughter of the lord of the high mountains, மாற்றோர் கூற்றே – O Death to enemies, வெற்றி வெல் போர்க் கொற்றவை சிறுவ – O son of Kotravai who is victorious in battles, இழை அணி சிறப்பின் பழையோள் குழவி – O child of the ancient goddess of the forest wearing splendid jewels, வானோர் வணங்கு வில் தானைத் தலைவ – O lord of the army with curved bows worshipped by celestials, மாலை மார்ப – O lord with flower garlands on your chest,  நூல் அறி புலவ – O wise man/poet who knows books, செருவில் ஒருவ – O lord who stands alone in battles, பொரு விறல் மள்ள – O brave warrior of battles, அந்தணர் வெறுக்கை  – you are the wealth of Brahmins, அறிந்தோர் சொல்மலை – O words of the wise,  மங்கையர் கணவ – O husband of women, மைந்தர் ஏறே  – O lion among warriors, வேல் கெழு தடக்கைச் சால்பெருஞ் செல்வ – O greatly noble lord with large hands that carry a spear, குன்றம் கொன்ற குன்றாக் கொற்றத்து – O great lord who broke a mountain victoriously, விண் பொரு நெடுவரைக் குறிஞ்சிக் கிழவ – O lord of the tall mountains that touch the sky, பலர் புகழ் நன்மொழிப் புலவர் ஏறே – O lord who is like a lion to poets with fine words and great fame, அரும் பெறல் மரபின் பெரும் பெயர் முருக – O Murukan with great name of precious tradition, நசையுநர்க்கு ஆர்த்தும் இசைபேர் ஆள  – O famed lord who gives boons to those who come with desire, அலந்தோர்க்கு அளிக்கும் பொலம்பூண் சேஎய் – O Murukan with gold jewels who gives to those who are suffering, மண்டு அமர் கடந்த நின் வென்று ஆடு அகலத்து பரிசிலர்த் தாங்கும் உருகெழு நெடுவேஎள் – O fierce lord whose victorious-in-close wars chest protects those who come to you in need (நெடுவேஎள் – இன்னிசை அளபெடை), பெரியோர் ஏத்தும் பெரும் பெயர் இயவுள் – O great God who is praised by the wise, சூர் மருங்கு அறுத்த மொய்ம்பின் மதவலி போர்மிகு பொருந குரிசில் – O lord with great strength who fought battles and killed Sooran and his relatives (மதவலி – ஒருபொருட் பன்மொழி), எனப்பல  யான் அறி அளவையின் – this is what I know, ஏத்தி  ஆன-   praise in this manner",Madurai Kanakkaayanaar son Nakkeerar,"பாடப்பட்டவன்:முருகப்பெருமான் திணை:பாடாண் துறை:ஆற்றுப்படை ஆசிரியப்பா முருகனைக் கண்டு துதித்தல்
","Paadaan Thinai aatrupadai Worshipping Murukan
"
29.0,மதுரைக் கணக்காயனார் மகனார் நக்கீரர்,"நின் அளந்து அறிதல் மன் உயிர்க்கு அருமையின்
நின் அடி உள்ளி வந்தனென் நின்னொடு
புரையுநர் இல்லாப் புலமையோய் எனக்    
குறித்தது மொழியா அளவையின் குறித்து உடன்  
","Even before you request like this,
for lives on earth.  I came here thinking about
surrendering to your feet, O Lord of spiritual
wealth with no equal,”
",Not available,"நின் அளந்து அறிதல் மன் உயிர்க்கு அருமையின் – to measure you and know you is impossible for lives on earth, நின் அடி உள்ளி வந்தனென் – I came thinking about surrendering to your feet, நின்னொடு புரையுநர் இல்லாப் புலமையோய் – O lord of spiritual wealth with nobody to match you, எனக் குறித்தது மொழியா அளவையின் – even before you request what you consider",Madurai Kanakkaayanaar son Nakkeerar,"பாடப்பட்டவன்:முருகப்பெருமான் திணை:பாடாண் துறை:ஆற்றுப்படை ஆசிரியப்பா முருகனைக் கண்டு துதித்தல்
","Paadaan Thinai aatrupadai Worshipping Murukan
"
30.0,மதுரைக் கணக்காயனார் மகனார் நக்கீரர்,"குறித்தது மொழியா அளவையின் குறித்து உடன்
வேறு பல் உருவின் குறும்பல் கூளியர்
சாறு அயர் களத்து வீறுபெறத் தோன்றி
அளியன் தானே முதுவாய் இரவலன்
வந்தோன் பெரும நின் வண்புகழ் நயந்து என
இனியவும் நல்லவும் நனிபல ஏத்தி  – 
","his devotees will appear in various forms in
an arena where festivals are celebrated with
great splendor, and plead for you in one voice
sweetly, very greatly and nicely,
with needs who desires you with great fame”.
","நனி – உறு தவ நனி என வரூஉம் மூன்றும் மிகுதி செய்யும் பொருள என்ப (தொல்காப்பியம், உரியியல் 3).","குறித்து உடன் – appeal together, வேறு பல் உருவின் குறும் பல் கூளியர் – workers/devotees in various forms, சாறு அயர் களத்து – in an arena where festivals are celebrated, வீறு பெறத் தோன்றி – appearing splendidly, அளியன் – he is a pitiable man, தானே முதுவாய் இரவலன் – a wise man with needs, வந்தோன் – the man who has come, பெரும – O lord, நின் வண் புகழ் நயந்து – desiring you with great fame, என இனியவும் நல்லவும் நனி பல ஏத்தி – thus they praise very greatly and sweetly and nicely",Madurai Kanakkaayanaar son Nakkeerar,"பாடப்பட்டவன்:முருகப்பெருமான் திணை:பாடாண் துறை:ஆற்றுப்படை ஆசிரியப்பா முருகனைக் கண்டு துதித்தல்
","Paadaan Thinai aatrupadai Worshipping Murukan
"
